src_id,zh,vi
4322,我们在巴尔的摩流行病学集水区或 ECA 研究随访的参与者中进行了这项研究。,Chúng tôi đã thực hiện nghiên cứu này ở những người tham gia trong nghiên cứu theo dõi Khu vực thu thập dịch tễ học Baltimore hoặc nghiên cứu ECA.
4323,这是一个以东巴尔的摩 (马里兰州) 为代表的人群队列，自 1981 年以来一直追踪研究。,"Đây là một nhóm người đại diện cho khu vực phía đông Baltimore, Maryland, được theo dõi từ năm 1981."
4324,美国国立精神卫生研究所流行病学集水区研究计划，提供了第一个基于人群的诊断与统计手册精神障碍（DSM）诊断的患病率和发病率估计。,"Chương trình Nghiên cứu Khu vực Bắt nước của Viện Sức khỏe Tâm thần Quốc gia, đã cung cấp các ước tính đầu tiên dựa trên dân số về tỷ lệ mắc và tỷ lệ phát sinh của Chẩn đoán và Thống kê Hướng dẫn về Rối loạn Tâm thần hoặc Chẩn đoán DSM."
4325,现在，在 ECA 的第四波，也就是 2004-2005 年，所有参与者都被要求捐献血液或口腔样本。,"Hiện tại, trong ECA, ở đợt thứ tư, diễn ra vào năm 2004-2005, tất cả những người tham gia đã được yêu cầu hiến máu hoặc mẫu tế bào má."
4326,我目前正与比尔·伊顿博士一起完成巴尔的摩ECA的第五波研究，我们正在研究35年来对压力的暴露。,"Hiện tại, tôi đang cùng với Tiến sĩ Bill Eaton hoàn thành đợt nghiên cứu thứ năm của ECA Baltimore, trong đó chúng tôi nghiên cứu những ảnh hưởng của căng thẳng trong 35 năm."
4327,除了其他因素外，它还与细胞衰老过程中的认知和功能下降有关。,"Điều này có liên quan đến sự suy giảm nhận thức và chức năng trong quá trình lão hóa tế bào, cùng với các yếu tố khác."
4327,顺便说一句，我们获得了该赠款的一部分，该赠款由NIA资助。,"Nhân tiện, chúng tôi đã nhận được một phần của khoản tài trợ đó, được tài trợ bởi NIA."
4327,感谢NIA。,Cảm ơn NIA.
4328,作为该拨款的一部分，我们从 NIA 收到了一个管理补充拨款，用于对 Wave 4 中储存的血液进行检测，以调查针对 HSV-1 的 IgG 抗体的水平。,"Là một phần của khoản tài trợ đó, chúng tôi đã nhận được một khoản bổ sung hành chính từ NIA để thực hiện các xét nghiệm trên máu được lưu trữ từ Wave 4 nhằm điều tra mức độ kháng thể IgG đối với HSV-1."
4329,本研究中，抗体阳性定义为巨细胞病毒 (CMV)、EB 病毒、水痘带状疱疹病毒 (VZV) 和弓形虫 (TOXO)。,"Trong nghiên cứu này, tính dương tính kháng thể được xác định bởi CMV, virus Epstein-Barr, VZV và TOXO."
4330,与每个检测中运行的标准样本相比，反应性。,Phản ứng so với các mẫu chuẩn được chạy trong mỗi thử nghiệm.
4330,我们的认知结局是简易精神状态检查，大多数，如果不是全部，你们都会熟悉它。,"Kết quả nhận thức của chúng tôi là bài kiểm tra Trạng thái Tâm thần Mini, mà hầu hết, nếu không phải tất cả, các bạn sẽ quen thuộc."
4331,一项包含 30 项的全球认知功能测试。,Một bài kiểm tra chức năng nhận thức toàn cầu gồm 30 mục.
4331,我们还使用了一个无词记忆测试，该测试在 2004 年的这一波调查中与 MMSE 一起进行。,Chúng tôi cũng đã sử dụng một bài kiểm tra trí nhớ không lời được thực hiện trong đợt khảo sát năm 2004 này cùng với MMSE.
4332,来自艾奥瓦州 EPESE 或为老年人流行病学研究而建立的人群。,từ EPESE Iowa hoặc các quần thể được thành lập cho các nghiên cứu dịch tễ học về người cao tuổi.
4332,ECA 研究人员向参与者朗读了 20 个常用词语，,"Nhân viên nghiên cứu ECA đã đọc 20 từ phổ biến cho những người tham gia,"
4333,并要求他们尽可能多地回忆，大约 20 分钟后，他们被要求再次回忆，进行延迟回忆任务。,"Và họ được yêu cầu nhớ lại nhiều nhất có thể, và có một nhiệm vụ nhớ lại trì hoãn khoảng 20 phút sau khi họ được yêu cầu nhớ lại một lần nữa."
4334,我们这里关注的是延迟回忆任务，因为这与阿尔茨海默病最相关，而不是即时回忆。,Chúng tôi tập trung vào nhiệm vụ hồi tưởng trì hoãn ở đây vì điều đó liên quan nhất đến bệnh Alzheimer so với hồi tưởng ngay lập tức.
4334,收集到的其他指标包括年龄的人口统计数据，,"Các biện pháp khác được thu thập là dữ liệu nhân khẩu học về tuổi tác,"
4335,性别、受教育年限、种族（我们将此分类为白人与非白人）以及 ApoE e4 等位基因携带者状态。,"Giới tính, số năm học, chủng tộc, mà chúng tôi đã phân loại ở đây là da trắng so với không phải da trắng, và tình trạng mang alen ApoE e4."
4336,我们计算了描述性统计数据，然后根据迷你精神状态检查和无词记忆延迟回忆任务的分布，,"Chúng tôi đã tính toán các thống kê mô tả và sau đó dựa trên phân bố của bài kiểm tra Trạng thái tinh thần tối thiểu và nhiệm vụ nhớ lại trì hoãn không lời,"
4338,我们的结果是项目，MMSE 上遗漏的项目数量，或基于泊松分布的无词记忆中正确回忆的词语数量。,"Kết quả của chúng tôi là các mục, số lượng mục bị bỏ lỡ trên MMSE, hoặc số lượng từ được nhớ lại chính xác cho bộ nhớ không lời dựa trên phân phối Poisson đó."
4339,这些是计数。,Đây là những con số.
4340,在给定参与者中，阳性检测次数与这些认知指标的绩效之间存在何种关联？,Mối liên hệ giữa số lượng xét nghiệm dương tính trong một người tham gia nhất định và hiệu suất trên các biện pháp nhận thức này là gì?
4340,我们的分析已针对年龄、性别、种族进行调整。,"Các phân tích của chúng tôi đã được điều chỉnh cho tuổi, giới tính, chủng tộc,"
4341,教育和ApoE e4等位基因状态。,giáo dục và tình trạng các alen ApoE e4.
4341,在结果方面，我们突然发现575名参与者，他们有关于抗体、认知测试和协方差的数据。,"Về kết quả, chúng tôi đột ngột có 575 người tham gia có dữ liệu về kháng thể, kiểm tra nhận thức và hiệp phương sai,"
4342,他们的平均年龄为 59 岁，女性占 63%，非白人占 36%，平均受教育年限为 12 年。,"Họ có độ tuổi trung bình là 59 tuổi, 63% là nữ, 36% là người không phải da trắng, họ có trung bình 12 năm học, trung bình."
4343,他们在首次接触这些词语后大约 20 分钟，错过了 1.7 个迷你精神状态检查项目，平均回忆起 5.5 个词。,"Họ đã bỏ lỡ 1,7 mục trong Bài kiểm tra Trạng thái Tâm thần Thu nhỏ và nhớ lại trung bình 5,5 từ, khoảng 20 phút sau khi họ được tiếp xúc với chúng lần đầu tiên."
4344,现在您可以看到参与者特征的分布情况，这是根据阳性抗体检测数量来划分的。,Bây giờ bạn có thể thấy sự phân bố các đặc điểm của người tham gia như là một hàm của số lượng xét nghiệm kháng thể dương tính.
4345,您可以看到，随着阳性检测数量的增加，年龄也随之增加。,Bạn có thể thấy rằng tuổi tác tăng lên khi số lượng xét nghiệm dương tính tăng lên.
4346,随着阳性抗体检测次数的增加，女性比例也在增加，同样地，随着阳性检测次数的增加，非白人参与者的比例也在增加。,"Tỷ lệ phụ nữ tăng lên khi số lượng xét nghiệm kháng thể dương tính tăng lên, cũng như tỷ lệ người tham gia không phải là người da trắng khi số lượng xét nghiệm dương tính tăng lên."
4347,受教育年限随着阳性检测次数的增加而减少，并且与 ApoE e4 携带者状态无关。,Số năm học giảm khi số lượng xét nghiệm dương tính tăng lên và không có mối liên hệ với tình trạng mang gen ApoE e4.
4348,现在，您可以看到一个我们认为非常引人注目的视觉描述。,"Bây giờ, bạn có thể thấy một mô tả trực quan mà chúng tôi cho rằng khá ấn tượng."
4348,迷你精神状态检查中漏掉的项目数量作为阳性抗体检测数量的函数。,Số lượng mục bị bỏ lỡ trong Bài kiểm tra Trạng thái Tâm thần Mini như một hàm của số lượng xét nghiệm kháng thể dương tính.
4350,正如您在这里所见，随着您进行的阳性测试次数增加，您可以看到 MMSE 上遗漏的项目数量，至少它很突出。,"Như bạn có thể thấy ở đây, khi số lượng xét nghiệm mà bạn dương tính tăng lên, bạn có thể thấy rằng số lượng mục bị bỏ qua trên MMSE, ít nhất là nó rất nổi bật."
4351,那个数字上升到了哪里。,Số đó lên đến đâu.
4351,当我们查看延迟回忆中我们答对的项目数量时，这是 EPESE 的一个组成部分。,"Khi chúng tôi xem xét số lượng các mục mà chúng tôi đã trả lời đúng trong phần hồi tưởng trì hoãn, một thành phần của EPESE là"
4352,在这个记忆测试中，更高的分数意味着更好的表现，您可以看到，随着阳性抗体测试数量的增加，正确回忆数量的表现下降。,"Trong bài kiểm tra trí nhớ này, điểm số cao hơn cho thấy hiệu suất tốt hơn, bạn có thể thấy rằng khi số lượng xét nghiệm kháng thể dương tính tăng lên, hiệu suất về số lượng hồi tưởng chính xác giảm xuống."
4353,当我们第一次看到这些时，我们对它们印象深刻。,Chúng tôi đã khá ấn tượng với chúng khi lần đầu tiên nhìn thấy chúng.
4353,然后，我们考虑了调整后的关联性，调整了年龄、性别、种族和教育水平。,"Sau đó, chúng tôi đã xem xét sự liên kết đã điều chỉnh, được điều chỉnh theo tuổi tác, giới tính, chủng tộc và giáo dục."
4355,不过，我们注意到，即使在调整后的分析中，,"Tuy nhiên, chúng tôi nhận thấy rằng ngay cả trong các phân tích điều chỉnh,"
4356,是否更多的阳性检测结果与迷你精神状态检查中漏掉的项目数量更多相关？,Liệu số lượng xét nghiệm dương tính nhiều hơn có liên quan đến số lượng mục bị bỏ lỡ trong Kiểm tra Trạng thái Tâm thần Mini nhiều hơn không?
4357,这是因为灰色头发没有达到统计学意义，但我们看到有，而我们在意义方面没有看到任何类似的东西。,"Điều này là do tóc bạc vì nó chưa đạt đến ý nghĩa thống kê, nhưng chúng ta thấy rằng có, trong khi chúng ta không thấy bất cứ điều gì tương tự như thế này về mặt ý nghĩa."
4358,左侧提示，在单词正确回忆的数量方面，可能存在关于阳性测试总数的某些情况。,Bên trái có một gợi ý rằng có thể có điều gì đó đang diễn ra về số lượng tổng thể các xét nghiệm dương tính so với số lượng từ được nhớ lại chính xác.
4359,你可以在这里看到一些东西。,Bạn có thể thấy một cái gì đó ở đây.
4359,我们确实查看了年龄、性别和 ApoE 与状态之间的相互作用。,"Chúng tôi đã xem xét sự tương tác giữa tuổi tác, giới tính và ApoE trước tình trạng."
4359,在年龄和性别方面，我们没有发现任何有趣的东西。,Chúng tôi đã không thấy bất cứ điều gì thú vị về tuổi tác và giới tính.
4360,我向您展示这个，因为我们认为尽管这个相互作用，p 值仍然值得关注。,"Tôi trình bày cái này cho bạn bởi vì chúng tôi nghĩ rằng nó đáng để xem xét mặc dù tương tác này, giá trị p."
4361,这是 ApoE4 携带者状态与过去感染对 MMSE 评分的影响。,Đây là sự tương tác của tình trạng mang ApoE4 với nhiễm trùng trong quá khứ đối với hiệu suất trên MMSE.
4361,再次提醒，MMSE 评分越高，混淆的数字就越多。,"Một lần nữa, hãy nhớ rằng MMSE càng cao, số lượng càng nhiều hỗn hợp."
4362,这是在查看整个样本。,Đây là đang xem xét toàn bộ mẫu.
4362,这是在查看ApoE4阴性者。,Đây là đang xem xét những người âm tính với ApoE4.
4363,然而，在 ApoE4 阳性的人群中，你可以看到，情况并非完全如此。,"Tuy nhiên, ở những người mang ApoE4 dương tính, bạn có thể thấy rằng bạn không thấy điều này theo cùng một cách."
4364,这种剂量-反应关联，这里可能存在各种因素。,"Sự liên kết liều-phản ứng này, và có nhiều thứ có thể xảy ra ở đây."
4364,我们应该考虑的一个因素是选择性流失，,Một trong những điều chúng ta nên xem xét là sự mất mát có chọn lọc do
4365,那些既是 E4 阳性又感染次数更多的人，这意味着他们受到的损害足够严重，无法继续参加研究。,"Những người vừa dương tính E4 vừa có số lần nhiễm trùng nhiều hơn, điều đó có nghĩa là họ bị suy yếu đủ mức và không thể tiếp tục tham gia nghiên cứu,"
4366,因此他们退出了，这就是我们在这里看不到他们的原因。,"Và vì vậy họ đã bỏ cuộc, đó là lý do tại sao chúng ta không thấy họ ở đây."
4366,然而，另一种可能性是，这可能存在某种潜在的保护作用。,"Tuy nhiên, một khả năng khác là có thể có một số hiệu quả bảo vệ tiềm ẩn."
4367,E4 等位基因对感染对认知的负面影响。,Các alen E4 về những ảnh hưởng tiêu cực của nhiễm trùng lên nhận thức.
4368,总之，在一个以人口为基础的中老年人群体中，,"Tóm lại, trong một nhóm người dựa trên dân số của những người trưởng thành trung niên và lớn tuổi,"
4371,性别、种族、教育程度和 E4 等位基因状态。,"Giới tính, chủng tộc, giáo dục và trạng thái alen E4."
4372,但是，我们不要对此过分关注。,Nhưng chúng ta đừng quá chú trọng vào điều đó.
4374,其他人已经谈到了检查抗菌干预措施的潜在作用的重要性。,Những người khác đã đề cập đến tầm quan trọng của việc kiểm tra vai trò tiềm năng của các can thiệp kháng khuẩn.
4374,从机制方面来说，,"Về cơ chế,"
4375,那是我们仍然需要检查的东西，无论它是炎症、表观遗传变化，还是像之前有人提到的那样。,"Đó là điều mà chúng ta vẫn cần phải kiểm tra, cho dù đó là viêm, thay đổi biểu sinh, như một số người đã đề cập trước đó."
4377,然后我存在偏见，因为这项研究，巴尔的摩ECA，真正关注的是与认知和功能下降相关的压力相关暴露。,"Sau đó, tôi có thiên kiến ​​vì nghiên cứu này, Baltimore ECA, thực sự tập trung vào các tiếp xúc liên quan đến căng thẳng liên quan đến suy giảm nhận thức và chức năng."
4378,但是，鉴于我们知道压力和压力反应可以调节免疫系统，我认为调查感染因子与压力之间的相互作用非常重要,"Nhưng xét đến việc chúng ta biết rằng căng thẳng và phản ứng căng thẳng có thể điều chỉnh hệ thống miễn dịch, tôi nghĩ rằng điều quan trọng là chúng ta phải điều tra sự tương tác giữa các tác nhân truyền nhiễm với căng thẳng."
4379,我要感谢NIA为我们在ECA中完成的工作提供的支持。,Tôi muốn cảm ơn NIA đã hỗ trợ chúng tôi thực hiện công việc mà chúng tôi đã làm trong ECA.
4380,我也要感谢我的合著者们。,Tôi cũng muốn cảm ơn các đồng tác giả của tôi.
4382,谢谢。,Cảm ơn bạn.
4382,Maria Nagel：非常感谢Spira博士。,Maria Nagel: Cảm ơn bác sĩ Spira rất nhiều.
4383,我们今天的下一位演讲者是来自哈佛大学的劳拉·考克斯博士。,Diễn giả tiếp theo của chúng ta hôm nay là Tiến sĩ Laura Cox đến từ Harvard.
4383,劳拉·考克斯：大家好，下午好。,Laura Cox: Xin chào mọi người.
4384,你能确认你是否能看到幻灯片吗？,Bạn có thể xác nhận rằng bạn có thể thấy các trang chiếu không?
4384,玛丽亚·纳格尔：是的，我能看到幻灯片。,"Maria Nagel: Vâng, tôi có thể thấy các trang chiếu."
4384,劳拉·考克斯：好的，太棒了。,"Laura Cox: Được rồi, tuyệt vời."
4385,我们将稍微改变一下话题，谈谈细菌。,Chúng ta sẽ chuyển hướng một chút và nói về vi khuẩn.
4386,由于我们正在转向一种新型的感染性触发因素，我想要讨论一下我们如何考虑阿尔茨海默病的厌氧病因及其影响。,"Vì chúng ta đang bắt đầu chuyển sang một loại kích hoạt nhiễm trùng mới, tôi chỉ muốn thảo luận về cách chúng ta có thể xem xét một nguyên nhân gây bệnh kỵ khí trong bệnh Alzheimer và tác động của nó."
4387,它可能与其他细菌感染因子以及病毒酵母感染因子不同。,Nó cũng có thể khác với các tác nhân gây nhiễm trùng vi khuẩn khác cũng như các tác nhân gây nhiễm trùng nấm men virus.
4387,其中一项是经典的厌氧细菌学。,Một điều là vi khuẩn kỵ khí cổ điển.
4388,我们知道，大多数厌氧菌感染实际上是内源性的，这意味着细菌来自正常的微生物群，并且,"Chúng ta biết rằng phần lớn các nhiễm trùng kỵ khí thực sự có nguồn gốc nội sinh, có nghĩa là vi khuẩn đến từ hệ vi sinh vật bình thường và chúng"
4389,我们也知道，高龄意味着更容易受到厌氧菌感染。,Chúng ta cũng biết rằng tuổi già đại diện cho một thời gian dễ bị nhiễm trùng kỵ khí hơn.
4390,这是由免疫衰老以及生理变化驱动的。,Điều này được thúc đẩy bởi sự lão hóa miễn dịch cũng như những thay đổi sinh lý.
4390,这可能是肠道屏障功能、血脑屏障功能的减弱，,"Điều này có thể là sự suy yếu chức năng hàng rào ruột, chức năng hàng rào máu não,"
4391,血液循环也减少了。,Lưu thông máu cũng giảm.
4393,我们知道肠道微生物群在衰老过程中会发生变化，我们在出生时需要它，它在成年早期成熟并稳定下来，在衰老过程中它会变得不稳定并发生变化。,"Chúng ta biết rằng hệ vi sinh vật đường ruột thay đổi trong suốt quá trình lão hóa, chúng ta cần nó khi sinh ra và nó trưởng thành và ổn định ở tuổi trưởng thành sớm và khi lão hóa, nó có thể bị mất ổn định và thay đổi."
4394,此外，这些变化会对我们的免疫系统产生功能性影响。,"Hơn nữa, những thay đổi này có thể có ảnh hưởng chức năng đến hệ miễn dịch của chúng ta."
4394,我们知道在衰老过程中，似乎存在两种截然相反的过程：,"Chúng ta biết rằng trong quá trình lão hóa, có hai quá trình dường như đối lập hoàn toàn:"
4395,实现免疫衰老，其中可能存在高循环炎症细胞因子，但同时也存在杀灭病原体的能力下降。,"Thực hiện quá trình lão hóa miễn dịch, trong đó có thể có nồng độ cytokine viêm tuần hoàn cao, nhưng đồng thời cũng có khả năng tiêu diệt mầm bệnh giảm."
4396,我们在对它的反应中看到了这种抵抗，它在许多其他方面是一个持续的压力源。,"Chúng tôi thấy sự kháng cự này như một phản ứng đối với nó, một căng thẳng liên tục trong nhiều thứ khác."
4396,我们在胰岛素抵抗中看到了这一点，,"Chúng tôi thấy điều này với tình trạng kháng insulin,"
4397,瘦素抵抗和肥胖。,kháng leptin và béo phì.
4397,你可以把它想象成对持续警报的抵抗。,Bạn có thể nghĩ về điều này như là một sự kháng cự đối với một báo động liên tục.
4397,这项美丽的研究表明，,Nghiên cứu tuyệt vời này đã cho thấy trong quá khứ
4398,2017 年，人们发现衰老的肠道微生物群实际上可以调节这种双重炎症和免疫衰老过程，如果将老年的微生物群移植到年轻的小鼠体内，,"Năm 2017, người ta phát hiện ra rằng vi khuẩn đường ruột già đi thực sự có thể điều chỉnh quá trình viêm và lão hóa miễn dịch kép này, trong đó nếu bạn chuyển vi khuẩn đường ruột già đi cho chuột con,"
4399,您可以增加TNF-α和IL-6，并减少吞噬作用的阻碍。,Bạn có thể tăng TNF-Alpha và IL-6 và giảm tắc nghẽn thực bào.
4399,如果您将年轻的微生物群转移到老年小鼠身上，您就可以部分逆转这一过程。,"Nếu bạn chuyển vi sinh vật trẻ sang chuột già, bạn có thể đảo ngược một phần quá trình này."
4400,我们如何控制它？,Làm cách nào để chúng ta kiểm soát điều đó?
4401,我们知道许多因素影响着我们的肠道微生物群，包括抗生素、生活方式、饮食和卫生，以及来自爱尔兰的一些非常棒的研究。,"Chúng ta biết rằng một số yếu tố tạo nên microbiome đường ruột của chúng ta, bao gồm kháng sinh, lối sống, chế độ ăn uống và vệ sinh, và một số nghiên cứu thực sự đẹp mắt đến từ Ireland."
4402,我们正在表明，肠道微生物群的组成与老年人的饮食和健康状况相关。,Chúng tôi đang chứng minh rằng thành phần vi sinh vật đường ruột có liên quan đến chế độ ăn uống và sức khỏe ở người cao tuổi.
4403,在阿尔茨海默病中具有有益作用。,có tác dụng có lợi trong bệnh Alzheimer.
4403,这让我们最初想知道，与热量限制相关的某些保护作用是否实际上与肠道微生物组的变化有关。,Điều này khiến chúng tôi ban đầu đặt câu hỏi liệu một số tác dụng bảo vệ được thấy với việc hạn chế calo có thực sự liên quan đến những thay đổi trong vi sinh vật đường ruột hay không.
4404,这是一次我在纽约大学研究生期间的宝贵合作。,Đây là một sự hợp tác tuyệt vời mà tôi đã có khi là sinh viên sau đại học tại NYU.
4404,我们发现，如果你仅仅通过降低碳水化合物部分的卡路里含量，,"Những gì chúng tôi phát hiện ra là nếu bạn giảm lượng calo chỉ từ phần carbohydrate,"
4405,它可以保护女性 TG 2576 个月的斑块 30%。,Nó có thể bảo vệ mảng bám ở nữ TG trong 2576 tháng ở mức 30%.
4405,然后我们观察了肠道微生物组随时间的变化，,"Sau đó, chúng tôi đã xem xét những thay đổi trong microbiome đường ruột theo thời gian,"
4406,我们发现，在衰老的阿尔茨海默病女性中，拟杆菌几乎增加了两倍，但这些水平通过我们的饮食得到了稳定。,"Và những gì chúng tôi tìm thấy là vi khuẩn Bacteroides gần như tăng gấp ba lần ở những phụ nữ bị bệnh Alzheimer già đi, nhưng những mức này đã được ổn định bởi chế độ ăn uống của chúng tôi."
4407,在大脑中与 A-Beta 40 和 A Beta-42 最相关的最强微生物。,Vi sinh vật mạnh nhất có liên quan đến A-Beta 40 và A Beta-42 trong não.
4407,这对我们来说真的很有趣，因为我们发现了,Điều này thực sự thú vị đối với chúng tôi bởi vì chúng tôi đã tìm thấy
4408,在人类群体中具有一定的转化相关性。,Có một số liên quan dịch thuật trong dân số người.
4408,然后最近的一项研究表明，这可能具有功能上的后果。,"Sau đó, một nghiên cứu gần đây cho thấy điều này có thể có những hậu quả chức năng."
4409,在85岁以上的人群中，细菌含量最高的人在为期四年的随访研究中，死亡风险增加。,"Ở những người trên 85 tuổi, những người có mức Bacteroides cao nhất có khả năng tử vong cao hơn trong một nghiên cứu theo dõi bốn năm."
4410,此外，两篇额外的论文，一篇来自 Vogt，另一篇来自 Heran 等人，发现阿尔茨海默病患者的拟杆菌含量升高。,"Ngoài ra, hai bài báo bổ sung, một của Vogt và một của Heran et al., đã phát hiện thấy lượng Bacteroides cao hơn ở những bệnh nhân Alzheimer."
4411,鉴于我们在小鼠和人类群体中的联系，我们接下来想在实验模型中测试这一点。,"Dựa trên kết nối của chúng tôi ở chuột và cả trong dân số người, chúng tôi muốn tiếp tục kiểm tra điều này trong các mô hình thử nghiệm."
