src_id,zh,vi
3756,我们可能会休息四分钟。,Chúng tôi có thể sẽ nghỉ ngơi trong bốn phút.
3756,再次感谢您，谭医生。,"Một lần nữa, cảm ơn bạn rất nhiều, Tiến sĩ Tanzi."
3757,精彩的演讲，精彩的问题。,"Bài nói chuyện tuyệt vời, những câu hỏi tuyệt vời."
3757,对于观众来说，很明显，如果你提出问题，,"Đối với những người trong khán giả, rõ ràng là nếu bạn đặt câu hỏi,"
3758,很明显，我们无法解答这些问题，因为时间不够。,"Rõ ràng, chúng tôi không thể giải quyết những câu hỏi đó, rõ ràng là không đủ thời gian."
3759,我们将收集这些评论，仔细阅读它们，进行评估和整理，这些评论可以帮助我们思考如何推动科学发展。,"Chúng tôi sẽ thu thập những ý kiến ​​đó, xem xét chúng, đánh giá, tổ chức chúng và những ý kiến ​​đó có thể giúp chúng tôi suy nghĩ về cách thúc đẩy khoa học tiến lên."
3760,差距在哪里？,Những khoảng trống ở đâu?
3761,有哪些机会？,Những cơ hội nào?
3761,我们应该如何推动科学发展？,Làm thế nào chúng ta nên thúc đẩy khoa học tiến bộ?
3761,我们也感谢这些意见。,Chúng tôi cũng đánh giá cao những ý kiến ​​đó.
3761,非常感谢。,Cảm ơn bạn rất nhiều.
3761,我们将在三分钟后，即11点重新集会。,Chúng tôi sẽ họp lại trong ba phút lúc 11 giờ.
3762,再次感谢您，谭医生。,Cảm ơn bác sĩ Tanzi một lần nữa.
3762,麦克斯·麦基维奇：美国东部时间现在是10点59分。,Mack Mackiewicz: Bây giờ là 10:59 giờ sáng ở bờ biển phía đông Hoa Kỳ.
3763,让我快速地评论一下。,Hãy để tôi bình luận nhanh chóng.
3763,我们再次对接下来的六个演示进行了结构化，从流行病学、计算和生物学开始。,"Chúng tôi đã cấu trúc lại sáu bài thuyết trình tiếp theo, bắt đầu từ dịch tễ học, tính toán và sinh học."
3764,病毒学专家，以及提出类似问题的专家，其实验设计具有可比性。,"Chuyên gia virus học và những người đặt câu hỏi tương tự, đã có thiết kế thử nghiệm tương đương."
3764,他不得不就感染因子与阿尔茨海默病得出相反的结论。,Anh ấy phải rút ra kết luận trái ngược về các tác nhân gây bệnh truyền nhiễm và bệnh Alzheimer.
3765,我认为，至少在我看来，我们需要重新设计和运行这些研究。,"Một lần nữa, theo tôi, ít nhất là ý kiến của tôi, chúng ta cần thiết kế lại và chạy những nghiên cứu đó."
3765,如果我们要支持这些研究，并且你运行它们，,"Nếu chúng ta phải hỗ trợ những nghiên cứu đó và bạn thực hiện chúng,"
3766,我很想知道您对如何设计这种状态的意见。,Thật tuyệt khi được nghe ý kiến của bạn về cách thiết kế trạng thái này.
3766,欢迎参加我们下一节会议，以及  Dr。,Chào mừng bạn đến phiên tiếp theo của chúng tôi và Tiến sĩ.
3767,来自 NIH 的史蒂文·雅各布森将主持本次会议。,Steven Jacobson từ NIH sẽ điều hành phiên này.
3767,雅各布森博士？,Tiến sĩ Jacobson?
3767,史蒂文·雅各布森：非常感谢，麦克。,"Steven Jacobson: Cảm ơn bạn rất nhiều, Mack."
3767,我真的很感谢。,Tôi thực sự đánh giá cao.
3768,您能听到我吗？,Anh có nghe thấy tôi không?
3768,我们好吗？,Chúng ta ổn chứ?
3768,Mack Mackiewicz：是的，我们能听到您，我们能看到您。,"Mack Mackiewicz: Vâng, chúng tôi có thể nghe thấy anh, chúng tôi có thể nhìn thấy anh."
3768,Steven Jacobson：谢谢。,Steven Jacobson: Cảm ơn.
3768,嗨。,Xin chào.
3768,再次感谢。,Cảm ơn một lần nữa.
3768,自我介绍一下，我是史蒂夫·雅各布森。,"Giới thiệu bản thân, tôi là Steve Jacobson."
3769,我是美国国立卫生研究院神经病学研究所病毒免疫学部门的负责人。,Tôi là Trưởng khoa miễn dịch học virus tại Viện thần kinh học NIH.
3770,实际上与另一种慢性神经疾病相关的疾病是多发性硬化症。,Một bệnh thần kinh mãn tính khác liên quan là bệnh đa xơ cứng.
3770,我们在这方面做了很多工作。,Chúng tôi đã thực hiện rất nhiều nghiên cứu về vấn đề này.
3770,我们的大部分精力已经转移到疱疹病毒上，,"Phần lớn năng lượng của chúng tôi đã chuyển sang các virus herpes,"
3771,既有EB病毒，也有HHV-6病毒。,Cả virus Epstein-Barr và HHV-6.
3771,我被要求主持这次会议，并展示我们的一些数据。,Tôi đã được yêu cầu chủ trì phiên họp này và trình bày một số dữ liệu của chúng tôi.
3772,但是，希望我们能在疱疹病毒和阿尔茨海默病这个重要议题上获得一些良好的互动和讨论。,"Nhưng một lần nữa, hy vọng chúng ta sẽ có được một số tương tác và thảo luận tốt về chủ đề quan trọng này về virus herpes và bệnh Alzheimer."
3773,他将讨论疱疹病毒感染、抗病毒治疗和阿尔茨海默病。,"Anh ấy sẽ nói về các bệnh nhiễm trùng do virus Herpes, điều trị kháng virus và bệnh Alzheimer."
3774,谢谢。,Cảm ơn bạn.
3774,雨果·洛夫海姆：是的。,Hugo Lovhelm: Vâng.
3774,非常感谢。,Cảm ơn bạn rất nhiều.
3774,您能帮我展示第一张幻灯片吗？,Bạn có thể chiếu slide đầu tiên của tôi được không?
3775,我将从流行病学角度，介绍我们关于这个主题的一些研究数据。,Tôi sẽ trình bày một số dữ liệu từ công việc của chúng tôi về chủ đề này từ quan điểm dịch tễ học.
3776,下一张幻灯片，请。,"Trang chiếu tiếp theo, làm ơn."
3777,虽然这种抗菌肽似乎对不同的病毒和细菌具有广泛的抗菌作用，但并非所有病原体都有可能建立,"Mặc dù peptide kháng khuẩn này dường như có tác dụng kháng khuẩn rộng phổ chống lại các loại virus và vi khuẩn khác nhau, nhưng không phải tất cả các mầm bệnh đều có khả năng thiết lập"
3778,脑部持续性感染会在体内持续很长时间。,Nhiễm trùng dai dẳng trong não có thể tồn tại trong một thời gian dài.
3779,它可以长期存在，免疫系统无法消除它，它还可以通过三叉神经到达大脑。,"Nó có thể tồn tại trong một thời gian dài, không thể bị hệ thống miễn dịch loại bỏ, và nó cũng có một con đường đến não thông qua dây thần kinh sinh ba."
3780,它可以诱发阿尔茨海默病斑块。,Nó có thể gây ra các mảng bám bệnh Alzheimer.
3781,这是一个我们一直在研究的模型。,Đây là mô hình mà chúng tôi đã làm việc.
3782,这不仅是因为我们携带单纯疱疹病毒，事实上大多数人都会，而且还因为缺乏对感染的控制。,"Không chỉ chúng ta mang virus herpes simplex, mà thực tế hầu hết mọi người đều mang, mà còn là sự thiếu kiểm soát đối với nhiễm trùng."
3784,我们认为这会导致多年来的慢性低度感染和抗菌反应,Chúng tôi nghĩ rằng điều này dẫn đến nhiễm trùng mãn tính cấp độ thấp và phản ứng kháng khuẩn trong nhiều năm
3785,导致阿尔茨海默病病理缓慢积累，随后出现症状性阿尔茨海默病。,dẫn đến sự tích tụ chậm bệnh lý Alzheimer và bệnh Alzheimer có triệu chứng sau này.
3785,下一张幻灯片，请。,"Slide tiếp theo, xin vui lòng."
3785,我来自,Tôi đến từ
3788,这意味着，不仅单纯疱疹病毒可以诱发这些变化，而且它在人群水平上也具有显著的影响。,"Điều đó có nghĩa là không chỉ herpes simplex có thể gây ra những thay đổi này, mà nó còn ảnh hưởng đáng kể ở cấp độ dân số."
3789,我们想调查一下。,Chúng tôi muốn điều tra điều đó.
3789,我们使用了两种主要的人群材料。,Chúng tôi đã sử dụng hai loại vật liệu nhóm chính.
3789,Betula 人群材料，,"Vật liệu nhóm Betula,"
3790,该研究跟踪了 3500 名个体多年，平均随访时间为 11.3 年，共记录了 245 例阿尔茨海默病病例。,"Nghiên cứu này theo dõi 3.500 cá nhân trong nhiều năm, với thời gian theo dõi trung bình là 11,3 năm và 245 trường hợp bệnh Alzheimer xảy ra."
3791,以及来自瑞典北部健康与疾病研究的另一项材料，其中我们有 360 例明确定义的阿尔茨海默病病例，以及数量相同的密切匹配的对照组。,"và một tài liệu khác từ Nghiên cứu Sức khỏe và Bệnh tật Bắc Thụy Điển, nơi chúng tôi có 360 trường hợp bệnh Alzheimer được xác định rõ ràng và một số lượng bằng nhau các đối chứng được khớp một cách chặt chẽ,"
3792,我们有大约在诊断前 10 年采集的血浆样本。,nơi chúng tôi có các mẫu huyết tương được lấy khoảng 10 năm trước khi chẩn đoán.
3792,在第二项研究中，我们可以,"Trong nghiên cứu thứ hai, chúng tôi có thể"
3793,几年前发表的一项研究首次发现单纯疱疹病毒携带与阿尔茨海默病风险增加之间存在关联。,Lần đầu tiên thấy mối liên hệ giữa việc mang virus Herpes simplex và nguy cơ mắc bệnh Alzheimer tăng lên được công bố cách đây vài năm.
3794,在 Betula 队列研究中，我们没有观察到携带单纯疱疹病毒的影响，但观察到近期复发的影响，通过血清中的 IgM 抗体来衡量。,"Trong nghiên cứu đoàn hệ Betula, chúng tôi không thấy tác động của việc mang virus Herpes, nhưng thấy tác động của sự tái hoạt động gần đây, được đo bằng kháng thể IgM trong huyết thanh."
3795,IgM 抗体是近期单纯疱疹病毒再激活的标志，与之相关的风险约为以后患上阿尔茨海默病的风险的两倍。,"Kháng thể IgM là dấu hiệu của sự tái hoạt động gần đây của virus Herpes simplex, và điều đó có liên quan đến nguy cơ tăng gấp đôi về bệnh Alzheimer sau này."
3796,这与之前从法国队列中报告的结果类似。,Đây là một kết quả tương tự như những gì đã được báo cáo trước đây từ một nhóm người Pháp.
3797,正如您所见，与 IgM 抗体相关的风险增加大约延迟了 8-10 年。,"Như bạn có thể thấy, nguy cơ gia tăng liên quan đến kháng thể IgM bị trì hoãn khoảng 8-10 năm."
3798,我的理解是，如果发生明显的病毒重新激活，那么疱疹病毒可能会进入大脑，然后开始这种缓慢的,"Sự hiểu biết của tôi là nếu có sự tái hoạt động đáng kể, thì virus herpes có thể xâm nhập vào não và sau đó bắt đầu quá trình chậm này,"
3799,持续感染和过程导致 10 年后出现有症状的阿尔茨海默病。,Nhiễm trùng dai dẳng và quá trình dẫn đến bệnh Alzheimer có triệu chứng 10 năm sau.
3799,下一张幻灯片，请。,"Trang chiếu tiếp theo, vui lòng."
3799,然后我们,Sau đó chúng tôi
3800,因为大多数人携带单纯疱疹病毒，但并非所有人都患有阿尔茨海默病，,"Bởi vì hầu hết mọi người đều mang virus herpes và không phải tất cả mọi người đều phát triển bệnh Alzheimer,"
3801,因此，一定有其他因素来解释这一点。,"Vì vậy, phải có các yếu tố bổ sung để giải thích điều này."
3802,那么解决方案就变得更加清晰了。,"sau đó, giải pháp trở nên rõ ràng hơn nhiều."
3803,认知障碍发生风险显著增加。,Nguy cơ phát triển suy giảm nhận thức tăng cao.
3803,下一张幻灯片。,Trang chiếu tiếp theo.
3803,在我们其他的资料中，,"Trong các tài liệu khác của chúng tôi,"
3804,在北瑞典健康与疾病研究中，我们还观察到了一种相互作用效应，即 APOE4 和单纯疱疹病毒 1 型的组合会导致阿尔茨海默病风险大幅增加。,"Trong nghiên cứu sức khỏe và bệnh tật ở Bắc Thụy Điển, chúng tôi cũng thấy một hiệu ứng tương tác với nguy cơ mắc bệnh Alzheimer tăng đáng kể khi kết hợp APOE4 và herpes simplex loại 1."
3805,下一张幻灯片。,Trang chiếu tiếp theo.
3805,在相同材料中，我们还研究了另外九个先前已知的阿尔茨海默病风险基因的遗传风险评分，并观察到相互作用。,"Trong cùng một tài liệu, chúng tôi cũng đã xem xét điểm số nguy cơ di truyền của chín gen nguy cơ bệnh Alzheimer đã biết trước đây và thấy rằng có sự tương tác."
3807,导致免疫系统无法控制病毒的遗传因素。,Các yếu tố di truyền khiến hệ thống miễn dịch không kiểm soát được virus.
3807,其中许多基因以不同的方式与免疫功能相关。,Nhiều gen trong số này đã được liên kết với chức năng miễn dịch theo những cách khác nhau.
3808,有趣的是，或者更重要的是，我们确实有治疗疱疹病毒的药物。,"Điều thú vị, hoặc quan trọng hơn, là chúng ta có thuốc điều trị virus herpes."
3808,从 80 年代中期开始，我们就有了像阿昔洛韦这样的药物。,"Từ giữa những năm 1980, chúng ta đã có những loại thuốc như acyclovir."
3811,一个非常有趣的问题是，这些药物是否也会影响日后患阿尔茨海默病的风险。,Một câu hỏi rất thú vị là liệu những loại thuốc này cũng có thể ảnh hưởng đến nguy cơ phát triển bệnh Alzheimer sau này hay không.
3811,下一张幻灯片。,Trang chiếu tiếp theo.
3812,"265,000名年龄超过50岁的受试者，被诊断出患有水痘-带状疱疹病毒或单纯疱疹病毒，或被开具抗病毒药物。",265.000 đối tượng trên 50 tuổi được chẩn đoán mắc virus varicella-zoster hoặc virus herpes simplex hoặc được kê đơn thuốc kháng virus.
3813,我们根据性别和出生年份将对照组与普通人群匹配，并跟踪了 12 年以观察痴呆症的发病率。,"Chúng tôi đã so khớp các đối chứng từ dân số chung theo giới tính và năm sinh, và chúng tôi đã theo dõi trong 12 năm để xác định tỷ lệ mắc bệnh sa sút trí tuệ."
3814,下一张幻灯片，请。,"Trang chiếu tiếp theo, làm ơn."
3815,这支持了感染风险增加的观点，当然。,"Điều này hỗ trợ nguy cơ nhiễm trùng tăng lên, tất nhiên."
3816,但同时也修改了抗病毒治疗的效果。,nhưng cũng sửa đổi tác động của việc điều trị bằng thuốc kháng virus.
3816,基于登记的研究的问题是，有太多,Vấn đề với các nghiên cứu dựa trên sổ đăng ký là có quá nhiều
3817,关于这些个体，我们还知之甚少，重要的是，这些个体基本上来自不同的群体；有诊断的群体和对照组。,"Chúng ta biết rất ít về các cá nhân, và điều quan trọng là, các cá nhân về cơ bản là các mẫu từ các quần thể khác nhau; những người được chẩn đoán và những người kiểm soát."
3818,因此，在第二项研究中，我们想在一个我们知道单纯疱疹病毒携带率的人群队列中研究这个问题。,"Do đó, trong một nghiên cứu thứ hai, chúng tôi muốn xem xét điều này trong một trong những nhóm quần thể dựa trên dân số của chúng tôi, nơi chúng tôi biết sự mang virus herpes simplex."
3819,我们知道他们的 APOE4 基因型。,Chúng tôi biết kiểu gen APOE4 của họ.
3820,我们可以在本地区追溯到 1995 年,"Chúng tôi có thể truy cập lại đến năm 1995 trong khu vực của chúng tôi,"
3821,我们识别出了 262 对匹配样本，随访时间为 11.4 年。,"và chúng tôi đã xác định được 262 cặp phù hợp với thời gian theo dõi là 11,4 năm."
3821,这是结果，,"Đây là kết quả,"
3822,我们发现，在随访期间服用抗病毒药物的人患阿尔茨海默病的风险降低了 70%。,Và chúng tôi thấy rằng những người được kê đơn thuốc kháng virus trong quá trình theo dõi có nguy cơ mắc bệnh Alzheimer thấp hơn 70%.
3823,再次支持在复发时给予抗病毒药物可以预防或降低日后患阿尔茨海默病风险的观点。,"Một lần nữa, ủng hộ ý tưởng rằng các loại thuốc kháng vi-rút được đưa ra vào thời điểm tái hoạt động có thể ngăn ngừa hoặc làm giảm nguy cơ phát triển bệnh Alzheimer sau này."
3824,即使我们在重新激活时进行为期两到四周的短暂治疗，也对阿尔茨海默病的风险有深远的影响。,"Nó có ảnh hưởng sâu sắc đến nguy cơ mắc bệnh Alzheimer, ngay cả khi chúng ta cho một liệu trình điều trị tương đối ngắn từ hai đến bốn tuần vào thời điểm tái hoạt động."
3825,下一张幻灯片。,Trang chiếu tiếp theo.
3825,这是从 1994 年至今瑞典抗病毒药物的总使用量。,Đây là tổng lượng thuốc kháng virus được sử dụng ở Thụy Điển từ năm 1994 đến nay.
3826,您看到使用量呈线性增长，这些药物随着时间的推移越来越多地使用。,"Bạn thấy sự gia tăng tuyến tính trong việc sử dụng, và những loại thuốc này được sử dụng nhiều hơn theo thời gian."
3827,我们在不同的时间点测量了具有 IgM 抗体的个体比例，作为近期重新激活的标志。,"Tại các thời điểm khác nhau, chúng tôi đã đo tỷ lệ cá nhân có kháng thể IgM, dấu hiệu của sự hoạt động lại gần đây."
3827,在这里，我们看到了明显的下降趋势，以及向,"Ở đây, chúng ta thấy một xu hướng giảm rõ ràng và chuyển sang"
3828,我们有两个时间点，分别来自2003-2005年和2008-2010年。,"Chúng tôi có hai điểm thời gian, thực sự là từ năm 2003-2005 và 2008-2010."
3829,其中只有约 1.5% 的人只有 IgM 抗体。,"trong đó chỉ khoảng 1,5% chỉ có kháng thể IgM."
3830,作为 IgM 抗体增加的复发，增加了阿尔茨海默病的风险，延迟 8-10 年。,Sự hoạt động lại được đo bằng sự gia tăng kháng thể IgM làm tăng nguy cơ bệnh Alzheimer với độ trễ 8-10 năm.
3831,2010 年，人们意外地发现了一个非常有趣的趋势，痴呆症的发病率从那时起开始下降。,"Năm 2010, người ta đã phát hiện ra một xu hướng bất ngờ và rất thú vị, đó là tỷ lệ mắc bệnh sa sút trí tuệ đã bắt đầu giảm trở lại."
3832,这是否与免疫控制改善有关，,"Liệu điều này có thể liên quan đến việc kiểm soát miễn dịch được cải thiện,"
3833,正如我在上一张幻灯片中所展示的那样，或者任何其他内容，我们目前还无法得知。,"Như tôi đã trình bày trong slide trước, hoặc bất cứ điều gì khác, chúng tôi không thể biết tại thời điểm này."
3833,总之，,"Tóm lại,"
3834,这种风险增加可能,Nguy cơ gia tăng này có khả năng
3835,在复发时使用抗病毒药物进行了修改。,đã được sửa đổi bằng cách sử dụng thuốc kháng virus tại thời điểm tái hoạt động.
3836,在无症状设置和有症状的阿尔茨海默病中。,trong các cài đặt tiền triệu chứng và trong bệnh Alzheimer có triệu chứng.
3836,谢谢。,Cảm ơn bạn.
3836,史蒂文·雅各布森：很好。,Steven Jacobson: Tuyệt vời.
3836,非常感谢，洛夫海姆医生。,"Cảm ơn bạn rất nhiều, Tiến sĩ Lovheim."
3837,那是一个精彩的演讲，我想我们可能会在最后的讨论环节回答问题。,Đó là một bài nói chuyện tuyệt vời và tôi nghĩ chúng ta sẽ xử lý các câu hỏi có lẽ vào cuối cùng trong cuộc thảo luận điều hành.
3838,我们将讨论疱疹病毒诊断、抗疱疹药物、疱疹疫苗与痴呆症之间的关联。,"Chúng ta sẽ thảo luận về mối liên quan giữa chẩn đoán virus herpes, thuốc kháng herpes, vắc xin herpes và chứng mất trí nhớ."
3838,谢谢。,Cảm ơn bạn.
3839,克里斯蒂安·施尼尔：是的，你好。,"Christian Schnier: Vâng, xin chào."
3839,非常感谢你邀请我做这个演讲。,Cảm ơn bạn rất nhiều vì đã mời tôi đến phát biểu.
3839,这里相当寒冷、潮湿和多风。,"Ở đây khá lạnh, ẩm ướt và gió."
3840,美国人民早上好。,Chào buổi sáng nước Mỹ.
3840,我代表我自己、珍妮特·詹贝克、理查德·拉特以及其他研究人员来介绍这项研究。,"Tôi trình bày nghiên cứu này thay mặt cho bản thân, Janet Janbek, Richard Lathe và các nhà nghiên cứu khác."
3841,我能看到第二个吗？,Tôi có thể nhìn thấy thứ hai không?
3842,马斯坦·纳恩：你想分享你的屏幕吗？,Mastan Narne: Bạn có muốn chia sẻ màn hình của bạn không?
3842,你熬夜了。,Bạn đã thức khuya.
3843,克里斯蒂安·施尼尔：我可以分享屏幕吗？,Christian Schnier: Tôi có thể chia sẻ màn hình không?
3843,是的，这样会更容易。,"Vâng, như vậy sẽ dễ dàng hơn."
3843,马斯坦·纳尔内：好的，你可以分享你的屏幕。,"Mastan Narne: Vâng, cứ việc chia sẻ màn hình của bạn đi."
3844,克里斯蒂安·施尼尔：共享屏幕。,Christian Schnier: Chia sẻ màn hình.
3844,你现在能看吗？,Bạn có thể xem bây giờ không?
3844,这是共享屏幕吗？,Đó là màn hình được chia sẻ?
3845,Mastan Narne：还没有。,Mastan Narne: Chưa có gì.
3845,你需要点击分享按钮。,Bạn cần phải nhấp vào nút Chia sẻ.
3845,Christian Schnier：正在再次尝试。,Christian Schnier: Tôi đang làm lại.
3845,对此表示歉意。,Xin lỗi về điều đó.
3846,史蒂文·雅各布森：我们在背景中看到了一只可爱的猪。,Steven Jacobson: Chúng ta thấy một con lợn dễ thương ở hậu cảnh.
3846,克里斯蒂安·施尼尔：不，那不是它应该做的。,"Christian Schnier: Không, đó không phải là điều nó nên làm."
3846,分享屏幕，而不是狗。,"Chia sẻ màn hình, không phải con chó."
3846,正在分享。,Đang chia sẻ.
3847,马斯坦·纳尔内：是的。,Mastan Narne: Vâng.
3847,麦克斯·麦基维奇：完美。,Mack Mackiewicz: Hoàn hảo.
3847,史蒂文·雅各布森：我们现在看到了。,Steven Jacobson: Chúng ta thấy nó bây giờ.
3848,我完全没有准备。,Tôi hoàn toàn không chuẩn bị gì cả.
3849,我们最近进行了一些新兴的研究。,Các nghiên cứu mới nổi gần đây mà chúng tôi đang tiến hành.
3849,第一个是抗疱疹药物与痴呆症的关联，另一个是抗疱疹疫苗与痴呆症的关联。,"Thứ nhất, sự liên kết của thuốc kháng herpes, và thứ hai là sự liên kết của vắc-xin kháng herpes với chứng mất trí nhớ."
3850,我将要介绍的研究遵循了 Lovhelm 刚刚提出的相同的大致思路。,Những nghiên cứu mà tôi sẽ trình bày theo cùng một ý tưởng chung mà Lovhelm vừa giới thiệu.
3850,我们定期收集电子健康记录来跟踪大量人群,Chúng tôi thường xuyên thu thập hồ sơ sức khỏe điện tử để theo dõi các quần thể lớn
3851,需要相当长的时间来测试这些不同的关联。,Cần một khoảng thời gian đáng kể để kiểm tra những liên kết khác nhau đó.
3851,就是这样。,Đó là nó.
3852,在第一项研究中，我们使用来自丹麦、德国、威尔士和苏格兰的电子健康记录来强制对队列研究进行单独观察。,"Đối với nghiên cứu đầu tiên, chúng tôi đã sử dụng hồ sơ sức khỏe điện tử từ Đan Mạch, Đức, xứ Wales và Scotland để áp dụng việc quan sát riêng biệt đối với các nghiên cứu đoàn hệ."
3855,肝后并发症最终可能介导这种关联。,Biến chứng sau gan có thể sau đó cuối cùng trung gian cho mối liên kết đó.
3855,但这可能取决于类型，,"Nhưng bây giờ điều đó có thể phụ thuộc vào loại,"
3856,这取决于单纯疱疹病毒感染的类型、药物类型和痴呆症的类型。,"Điều này phụ thuộc vào loại nhiễm trùng herpes, loại thuốc và loại chứng mất trí nhớ."
3856,但是想想，我这里用了很多条件语言。,"Nhưng hãy suy nghĩ về điều đó, tôi đang sử dụng rất nhiều ngôn ngữ có điều kiện ở đây."
3857,有很多也许和类似的事情。,Có rất nhiều có lẽ và những thứ tương tự như thế này.
3857,也许是免疫系统的抑制让出了空间。,Có thể đó là sự ức chế hệ thống miễn dịch tạo ra khoảng trống.
